<?xml version="1.0" encoding="utf-8"?>
<tickets xmlns:xsi="http://www.w3.org/2001/XMLSchema-instance" xsi:noNamespaceSchemaLocation="tickets-support-ticket.xsd">
    <ticket>
        <number>1</number>
        <dateOfIssue>2021-01-31T17:24:49</dateOfIssue>
        <status>On-going</status>
        <userId>0001</userId>
        <inquiryType>Products</inquiryType>
        <messages>
            <message userId="0001" userName="Ikumi Mine" sendDateTime="2021-01-31T12:30:06">I am interested in purchasing a sweater whose product number is ac0921. I am wondering if you have xs-size for it? I couldn't find information for it on your website.</message>
        <message userId="0001" userName="Ikumi Mine" sendDateTime="2021-04-03T12:48:38-04:00">test</message>
        </messages>
    </ticket>
    <ticket>
        <number>2</number>
        <dateOfIssue>2021-02-27T17:24:49</dateOfIssue>
        <status>New</status>
        <userId>0001</userId>
        <inquiryType>General</inquiryType>
        <messages>
            <message userId="0001" userName="Ikumi Mine" sendDateTime="2021-02-28T12:30:06">I am interested in purchasing a sweater whose product number is ac0921. I am wondering if you have xs-size for it? I couldn't find information for it on your website.</message>
        <message userId="0002" userName="Rey Abdul" sendDateTime="2021-04-02T22:54:26-04:00">answer</message></messages>
    </ticket>
<ticket><number>3</number><dateOfIssue>2021-04-02T22:04:45-04:00</dateOfIssue><status>On-going</status><userId>0001</userId><inquiryType>Products</inquiryType><messages><message userId="0001" userName="Ikumi Mine" sendDateTime="2021-04-02T22:04:45-04:00">test</message><message userId="0002" userName="Rey Abdul" sendDateTime="2021-04-03T12:39:35-04:00">test</message></messages></ticket><ticket><number>4</number><dateOfIssue>2021-05-18T14:20:26-04:00</dateOfIssue><status>On-going</status><userId>0001</userId><inquiryType>Careers</inquiryType><messages><message userId="0001" userName="Ikumi Mine" sendDateTime="2021-05-18T14:20:26-04:00">test</message><message userId="0002" userName="Rey Abdul" sendDateTime="2021-05-18T14:36:28-04:00">test</message></messages></ticket></tickets>
